{
  "schema_version": 1,
  "snapshot_id": "knowledge.sample-1",
  "version": "1",
  "scope": {
    "game_id": "test-game",
    "scene_id": "menu",
    "profile_id": "low-resource",
    "player_id": "player.one",
    "lineage_id": "lineage.one"
  },
  "created_at": "2026-11-01T00:00:00Z",
  "expires_at": null,
  "sample_count": 3,
  "uncertainty": 0.7,
  "action_outcome_stats": {
    "score-label": {
      "count": 3,
      "success": 0,
      "no_effect": 2,
      "failure": 0,
      "unknown": 1,
      "reward_mean": -1.0,
      "reward_ewma": -0.36,
      "alpha": 1.0,
      "beta": 3.0
    }
  },
  "candidate_priors": {
    "score-label": -0.4
  },
  "candidate_reliability": {
    "score-label": 0.9
  },
  "transition_priors": [
    {
      "from_state": "menu",
      "action_id": "score-label",
      "to_state": "menu",
      "probability": 1.0,
      "count": 3
    }
  ],
  "weight_hints": {
    "utility": 1.0
  },
  "threshold_hints": {
    "recognition_minimum": 0.6
  },
  "roi_hints": {
    "score-panel": [
      0.0,
      0.0,
      0.2,
      0.1
    ]
  },
  "source_experience_range": [
    {
      "source_id": "session.one",
      "first_sequence": 1,
      "last_sequence": 3,
      "event_count": 3,
      "sha256": "1111111111111111111111111111111111111111111111111111111111111111"
    }
  ],
  "update_rule": "beta-ewma",
  "update_rule_version": "1",
  "builder_state": {
    "source_watermarks": {
      "session.one": 3
    },
    "correlation_watermarks": {}
  }
}
